{
  "schema": "ucc.material",
  "schema_version": 1,
  "id": "col_01K0A6R4V8W6E3M4M8Y0R9J2QC",
  "created_at": "2026-08-22T12:00:00.000Z",
  "created_by": "act_01K0A6R4V8W6E3M4M8Y0R9J2QA",
  "record_version": 1,
  "material_type": "sources",
  "name": "benchmark-suite",
  "uri_or_path": "sources/benchmark",
  "content_hash": "sha256:0123456789abcdef0123456789abcdef0123456789abcdef0123456789abcdef"
}
